{"schema":"mr.identities/1","version":"2026-09-27T040221Z","side":"corp","restriction":"standard_ban_list_26_05","tier_group":"store","period":{"from":"2026-05","to":"2026-07"},"baseline":{"entries":9,"games":0,"wins":0,"winrate":null,"cut_entries":9,"cut_made":3,"cut_rate":0.3333},"identities":[{"card_id":"epiphany_analytica_nations_undivided","entries":2,"share":0.2222,"games":0,"wins":0.0,"winrate":null,"winrate_diff_pp":null,"wilson_low_pp":null,"wilson_high_pp":null,"winrate_status":"insufficient","cut_entries":2,"cut_made":1,"conversion":0.5,"conversion_ratio":1.5,"conversion_status":"insufficient","rank":1},{"card_id":"haas_bioroid_precision_design","entries":2,"share":0.2222,"games":0,"wins":0.0,"winrate":null,"winrate_diff_pp":null,"wilson_low_pp":null,"wilson_high_pp":null,"winrate_status":"insufficient","cut_entries":2,"cut_made":1,"conversion":0.5,"conversion_ratio":1.5,"conversion_status":"insufficient","rank":2},{"card_id":"a_teia_ip_recovery","entries":1,"share":0.1111,"games":0,"wins":0.0,"winrate":null,"winrate_diff_pp":null,"wilson_low_pp":null,"wilson_high_pp":null,"winrate_status":"insufficient","cut_entries":1,"cut_made":0,"conversion":0.0,"conversion_ratio":0.0,"conversion_status":"insufficient","rank":3},{"card_id":"jinteki_restoring_humanity","entries":1,"share":0.1111,"games":0,"wins":0.0,"winrate":null,"winrate_diff_pp":null,"wilson_low_pp":null,"wilson_high_pp":null,"winrate_status":"insufficient","cut_entries":1,"cut_made":0,"conversion":0.0,"conversion_ratio":0.0,"conversion_status":"insufficient","rank":4},{"card_id":"synapse_global_faster_than_thought","entries":1,"share":0.1111,"games":0,"wins":0.0,"winrate":null,"winrate_diff_pp":null,"wilson_low_pp":null,"wilson_high_pp":null,"winrate_status":"insufficient","cut_entries":1,"cut_made":0,"conversion":0.0,"conversion_ratio":0.0,"conversion_status":"insufficient","rank":5},{"card_id":"thunderbolt_armaments_peace_through_power","entries":1,"share":0.1111,"games":0,"wins":0.0,"winrate":null,"winrate_diff_pp":null,"wilson_low_pp":null,"wilson_high_pp":null,"winrate_status":"insufficient","cut_entries":1,"cut_made":1,"conversion":1.0,"conversion_ratio":3.0,"conversion_status":"insufficient","rank":6},{"card_id":"weyland_consortium_built_to_last","entries":1,"share":0.1111,"games":0,"wins":0.0,"winrate":null,"winrate_diff_pp":null,"wilson_low_pp":null,"wilson_high_pp":null,"winrate_status":"insufficient","cut_entries":1,"cut_made":0,"conversion":0.0,"conversion_ratio":0.0,"conversion_status":"insufficient","rank":7}]}