{"schema":"mr.identities/1","version":"2026-09-27T040220Z","side":"runner","restriction":"standard_balance_update_26_08","tier_group":"all","period":{"from":"2026-07","to":"2026-09"},"baseline":{"entries":41,"games":94,"wins":44.5,"winrate":0.4734,"cut_entries":23,"cut_made":6,"cut_rate":0.2609},"identities":[{"card_id":"zahya_sadeghi_versatile_smuggler","entries":7,"share":0.1707,"games":14,"wins":10.5,"winrate":0.75,"winrate_diff_pp":27.66,"wilson_low_pp":1.48,"wilson_high_pp":43.08,"winrate_status":"insufficient","cut_entries":4,"cut_made":3,"conversion":0.75,"conversion_ratio":2.875,"conversion_status":"insufficient","rank":1},{"card_id":"lat_ethical_freelancer","entries":6,"share":0.1463,"games":11,"wins":5.0,"winrate":0.4545,"winrate_diff_pp":-1.89,"wilson_low_pp":-26.07,"wilson_high_pp":24.65,"winrate_status":"insufficient","cut_entries":3,"cut_made":1,"conversion":0.3333,"conversion_ratio":1.278,"conversion_status":"insufficient","rank":2},{"card_id":"barry_baz_wong_tri_maf_veteran","entries":5,"share":0.122,"games":9,"wins":2.5,"winrate":0.2778,"winrate_diff_pp":-19.56,"wilson_low_pp":-38.3,"wilson_high_pp":12.47,"winrate_status":"insufficient","cut_entries":3,"cut_made":0,"conversion":0.0,"conversion_ratio":0.0,"conversion_status":"insufficient","rank":3},{"card_id":"magdalene_keino_chemutai_cryptarchitect","entries":5,"share":0.122,"games":12,"wins":7.0,"winrate":0.5833,"winrate_diff_pp":10.99,"wilson_low_pp":-15.39,"wilson_high_pp":33.33,"winrate_status":"insufficient","cut_entries":3,"cut_made":1,"conversion":0.3333,"conversion_ratio":1.278,"conversion_status":"insufficient","rank":4},{"card_id":"rene_loup_arcemont_party_animal","entries":5,"share":0.122,"games":9,"wins":5.0,"winrate":0.5556,"winrate_diff_pp":8.22,"wilson_low_pp":-20.68,"wilson_high_pp":33.78,"winrate_status":"insufficient","cut_entries":3,"cut_made":0,"conversion":0.0,"conversion_ratio":0.0,"conversion_status":"insufficient","rank":5},{"card_id":"tao_salonga_telepresence_magician","entries":5,"share":0.122,"games":12,"wins":4.5,"winrate":0.375,"winrate_diff_pp":-9.84,"wilson_low_pp":-30.84,"wilson_high_pp":17.22,"winrate_status":"insufficient","cut_entries":3,"cut_made":1,"conversion":0.3333,"conversion_ratio":1.278,"conversion_status":"insufficient","rank":6},{"card_id":"esa_afontov_eco_insurrectionist","entries":4,"share":0.0976,"games":15,"wins":7.0,"winrate":0.4667,"winrate_diff_pp":-0.67,"wilson_low_pp":-22.53,"wilson_high_pp":22.54,"winrate_status":"insufficient","cut_entries":2,"cut_made":0,"conversion":0.0,"conversion_ratio":0.0,"conversion_status":"insufficient","rank":7},{"card_id":"topan_ormas_leader","entries":4,"share":0.0976,"games":12,"wins":3.0,"winrate":0.25,"winrate_diff_pp":-22.34,"wilson_low_pp":-38.45,"wilson_high_pp":5.89,"winrate_status":"insufficient","cut_entries":2,"cut_made":0,"conversion":0.0,"conversion_ratio":0.0,"conversion_status":"insufficient","rank":8}]}