{"schema":"mr.identities/1","version":"2026-09-27T040000Z","side":"corp","restriction":"all","tier_group":"all","period":{"from":"2026-07","to":"2026-09"},"baseline":{"entries":50,"games":94,"wins":49.5,"winrate":0.5266,"cut_entries":32,"cut_made":9,"cut_rate":0.2812},"identities":[{"card_id":"haas_bioroid_precision_design","entries":9,"share":0.18,"games":10,"wins":6.0,"winrate":0.6,"winrate_diff_pp":7.34,"wilson_low_pp":-21.39,"wilson_high_pp":30.52,"winrate_status":"insufficient","cut_entries":6,"cut_made":2,"conversion":0.3333,"conversion_ratio":1.185,"conversion_status":"insufficient","rank":1},{"card_id":"epiphany_analytica_nations_undivided","entries":8,"share":0.16,"games":13,"wins":10.0,"winrate":0.7692,"winrate_diff_pp":24.26,"wilson_low_pp":-2.92,"wilson_high_pp":39.16,"winrate_status":"insufficient","cut_entries":5,"cut_made":1,"conversion":0.2,"conversion_ratio":0.711,"conversion_status":"insufficient","rank":2},{"card_id":"jinteki_restoring_humanity","entries":6,"share":0.12,"games":9,"wins":6.0,"winrate":0.6667,"winrate_diff_pp":14.01,"wilson_low_pp":-17.24,"wilson_high_pp":35.28,"winrate_status":"insufficient","cut_entries":4,"cut_made":0,"conversion":0.0,"conversion_ratio":0.0,"conversion_status":"insufficient","rank":3},{"card_id":"synapse_global_faster_than_thought","entries":6,"share":0.12,"games":10,"wins":5.0,"winrate":0.5,"winrate_diff_pp":-2.66,"wilson_low_pp":-29.0,"wilson_high_pp":23.68,"winrate_status":"insufficient","cut_entries":4,"cut_made":2,"conversion":0.5,"conversion_ratio":1.778,"conversion_status":"insufficient","rank":4},{"card_id":"thunderbolt_armaments_peace_through_power","entries":6,"share":0.12,"games":14,"wins":6.0,"winrate":0.4286,"winrate_diff_pp":-9.8,"wilson_low_pp":-31.28,"wilson_high_pp":14.75,"winrate_status":"insufficient","cut_entries":4,"cut_made":2,"conversion":0.5,"conversion_ratio":1.778,"conversion_status":"insufficient","rank":5},{"card_id":"a_teia_ip_recovery","entries":5,"share":0.1,"games":15,"wins":9.5,"winrate":0.6333,"winrate_diff_pp":10.67,"wilson_low_pp":-13.97,"wilson_high_pp":29.88,"winrate_status":"insufficient","cut_entries":3,"cut_made":2,"conversion":0.6667,"conversion_ratio":2.37,"conversion_status":"insufficient","rank":6},{"card_id":"earth_station_sea_headquarters","entries":5,"share":0.1,"games":10,"wins":2.5,"winrate":0.25,"winrate_diff_pp":-27.66,"wilson_low_pp":-44.56,"wilson_high_pp":3.12,"winrate_status":"insufficient","cut_entries":3,"cut_made":0,"conversion":0.0,"conversion_ratio":0.0,"conversion_status":"insufficient","rank":7},{"card_id":"weyland_consortium_built_to_last","entries":5,"share":0.1,"games":13,"wins":4.5,"winrate":0.3462,"winrate_diff_pp":-18.04,"wilson_low_pp":-37.53,"wilson_high_pp":8.46,"winrate_status":"insufficient","cut_entries":3,"cut_made":0,"conversion":0.0,"conversion_ratio":0.0,"conversion_status":"insufficient","rank":8}]}