{"schema":"mr.identities/1","version":"2026-09-27T040221Z","side":"runner","restriction":"standard_ban_list_26_05","tier_group":"store","period":{"from":"2026-05","to":"2026-07"},"baseline":{"entries":9,"games":0,"wins":0,"winrate":null,"cut_entries":9,"cut_made":3,"cut_rate":0.3333},"identities":[{"card_id":"lat_ethical_freelancer","entries":2,"share":0.2222,"games":0,"wins":0.0,"winrate":null,"winrate_diff_pp":null,"wilson_low_pp":null,"wilson_high_pp":null,"winrate_status":"insufficient","cut_entries":2,"cut_made":1,"conversion":0.5,"conversion_ratio":1.5,"conversion_status":"insufficient","rank":1},{"card_id":"zahya_sadeghi_versatile_smuggler","entries":2,"share":0.2222,"games":0,"wins":0.0,"winrate":null,"winrate_diff_pp":null,"wilson_low_pp":null,"wilson_high_pp":null,"winrate_status":"insufficient","cut_entries":2,"cut_made":1,"conversion":0.5,"conversion_ratio":1.5,"conversion_status":"insufficient","rank":2},{"card_id":"barry_baz_wong_tri_maf_veteran","entries":1,"share":0.1111,"games":0,"wins":0.0,"winrate":null,"winrate_diff_pp":null,"wilson_low_pp":null,"wilson_high_pp":null,"winrate_status":"insufficient","cut_entries":1,"cut_made":1,"conversion":1.0,"conversion_ratio":3.0,"conversion_status":"insufficient","rank":3},{"card_id":"esa_afontov_eco_insurrectionist","entries":1,"share":0.1111,"games":0,"wins":0.0,"winrate":null,"winrate_diff_pp":null,"wilson_low_pp":null,"wilson_high_pp":null,"winrate_status":"insufficient","cut_entries":1,"cut_made":0,"conversion":0.0,"conversion_ratio":0.0,"conversion_status":"insufficient","rank":4},{"card_id":"magdalene_keino_chemutai_cryptarchitect","entries":1,"share":0.1111,"games":0,"wins":0.0,"winrate":null,"winrate_diff_pp":null,"wilson_low_pp":null,"wilson_high_pp":null,"winrate_status":"insufficient","cut_entries":1,"cut_made":0,"conversion":0.0,"conversion_ratio":0.0,"conversion_status":"insufficient","rank":5},{"card_id":"tao_salonga_telepresence_magician","entries":1,"share":0.1111,"games":0,"wins":0.0,"winrate":null,"winrate_diff_pp":null,"wilson_low_pp":null,"wilson_high_pp":null,"winrate_status":"insufficient","cut_entries":1,"cut_made":0,"conversion":0.0,"conversion_ratio":0.0,"conversion_status":"insufficient","rank":6},{"card_id":"topan_ormas_leader","entries":1,"share":0.1111,"games":0,"wins":0.0,"winrate":null,"winrate_diff_pp":null,"wilson_low_pp":null,"wilson_high_pp":null,"winrate_status":"insufficient","cut_entries":1,"cut_made":0,"conversion":0.0,"conversion_ratio":0.0,"conversion_status":"insufficient","rank":7}]}