{"schema":"mr.identities/1","version":"2026-09-27T040221Z","side":"runner","restriction":"standard_balance_update_26_08","tier_group":"store","period":{"from":"2026-07","to":"2026-09"},"baseline":{"entries":8,"games":22,"wins":11.5,"winrate":0.5227,"cut_entries":0,"cut_made":0,"cut_rate":null},"identities":[{"card_id":"barry_baz_wong_tri_maf_veteran","entries":1,"share":0.125,"games":3,"wins":1.0,"winrate":0.3333,"winrate_diff_pp":-18.94,"wilson_low_pp":-46.12,"wilson_high_pp":26.96,"winrate_status":"insufficient","cut_entries":0,"cut_made":0,"conversion":null,"conversion_ratio":null,"conversion_status":"insufficient","rank":1},{"card_id":"esa_afontov_eco_insurrectionist","entries":1,"share":0.125,"games":3,"wins":3.0,"winrate":1.0,"winrate_diff_pp":47.73,"wilson_low_pp":-8.42,"wilson_high_pp":47.73,"winrate_status":"insufficient","cut_entries":0,"cut_made":0,"conversion":null,"conversion_ratio":null,"conversion_status":"insufficient","rank":2},{"card_id":"lat_ethical_freelancer","entries":1,"share":0.125,"games":3,"wins":1.0,"winrate":0.3333,"winrate_diff_pp":-18.94,"wilson_low_pp":-46.12,"wilson_high_pp":26.96,"winrate_status":"insufficient","cut_entries":0,"cut_made":0,"conversion":null,"conversion_ratio":null,"conversion_status":"insufficient","rank":3},{"card_id":"magdalene_keino_chemutai_cryptarchitect","entries":1,"share":0.125,"games":2,"wins":1.0,"winrate":0.5,"winrate_diff_pp":-2.27,"wilson_low_pp":-42.82,"wilson_high_pp":38.27,"winrate_status":"insufficient","cut_entries":0,"cut_made":0,"conversion":null,"conversion_ratio":null,"conversion_status":"insufficient","rank":4},{"card_id":"rene_loup_arcemont_party_animal","entries":1,"share":0.125,"games":3,"wins":2.0,"winrate":0.6667,"winrate_diff_pp":14.39,"wilson_low_pp":-31.51,"wilson_high_pp":41.58,"winrate_status":"insufficient","cut_entries":0,"cut_made":0,"conversion":null,"conversion_ratio":null,"conversion_status":"insufficient","rank":5},{"card_id":"tao_salonga_telepresence_magician","entries":1,"share":0.125,"games":2,"wins":0.5,"winrate":0.25,"winrate_diff_pp":-27.27,"wilson_low_pp":-49.6,"wilson_high_pp":27.94,"winrate_status":"insufficient","cut_entries":0,"cut_made":0,"conversion":null,"conversion_ratio":null,"conversion_status":"insufficient","rank":6},{"card_id":"topan_ormas_leader","entries":1,"share":0.125,"games":3,"wins":0.0,"winrate":0.0,"winrate_diff_pp":-52.27,"wilson_low_pp":-52.27,"wilson_high_pp":3.88,"winrate_status":"insufficient","cut_entries":0,"cut_made":0,"conversion":null,"conversion_ratio":null,"conversion_status":"insufficient","rank":7},{"card_id":"zahya_sadeghi_versatile_smuggler","entries":1,"share":0.125,"games":3,"wins":3.0,"winrate":1.0,"winrate_diff_pp":47.73,"wilson_low_pp":-8.42,"wilson_high_pp":47.73,"winrate_status":"insufficient","cut_entries":0,"cut_made":0,"conversion":null,"conversion_ratio":null,"conversion_status":"insufficient","rank":8}]}