{"schema":"mr.identities/1","version":"2026-09-27T040221Z","side":"corp","restriction":"standard_balance_update_26_08","tier_group":"store","period":{"from":"2026-07","to":"2026-09"},"baseline":{"entries":8,"games":22,"wins":10.5,"winrate":0.4773,"cut_entries":0,"cut_made":0,"cut_rate":null},"identities":[{"card_id":"a_teia_ip_recovery","entries":1,"share":0.125,"games":3,"wins":2.0,"winrate":0.6667,"winrate_diff_pp":18.94,"wilson_low_pp":-26.96,"wilson_high_pp":46.12,"winrate_status":"insufficient","cut_entries":0,"cut_made":0,"conversion":null,"conversion_ratio":null,"conversion_status":"insufficient","rank":1},{"card_id":"earth_station_sea_headquarters","entries":1,"share":0.125,"games":3,"wins":0.0,"winrate":0.0,"winrate_diff_pp":-47.73,"wilson_low_pp":-47.73,"wilson_high_pp":8.42,"winrate_status":"insufficient","cut_entries":0,"cut_made":0,"conversion":null,"conversion_ratio":null,"conversion_status":"insufficient","rank":2},{"card_id":"epiphany_analytica_nations_undivided","entries":1,"share":0.125,"games":3,"wins":1.0,"winrate":0.3333,"winrate_diff_pp":-14.39,"wilson_low_pp":-41.58,"wilson_high_pp":31.51,"winrate_status":"insufficient","cut_entries":0,"cut_made":0,"conversion":null,"conversion_ratio":null,"conversion_status":"insufficient","rank":3},{"card_id":"haas_bioroid_precision_design","entries":1,"share":0.125,"games":3,"wins":2.0,"winrate":0.6667,"winrate_diff_pp":18.94,"wilson_low_pp":-26.96,"wilson_high_pp":46.12,"winrate_status":"insufficient","cut_entries":0,"cut_made":0,"conversion":null,"conversion_ratio":null,"conversion_status":"insufficient","rank":4},{"card_id":"jinteki_restoring_humanity","entries":1,"share":0.125,"games":2,"wins":1.0,"winrate":0.5,"winrate_diff_pp":2.27,"wilson_low_pp":-38.27,"wilson_high_pp":42.82,"winrate_status":"insufficient","cut_entries":0,"cut_made":0,"conversion":null,"conversion_ratio":null,"conversion_status":"insufficient","rank":5},{"card_id":"synapse_global_faster_than_thought","entries":1,"share":0.125,"games":2,"wins":1.0,"winrate":0.5,"winrate_diff_pp":2.27,"wilson_low_pp":-38.27,"wilson_high_pp":42.82,"winrate_status":"insufficient","cut_entries":0,"cut_made":0,"conversion":null,"conversion_ratio":null,"conversion_status":"insufficient","rank":6},{"card_id":"thunderbolt_armaments_peace_through_power","entries":1,"share":0.125,"games":3,"wins":1.0,"winrate":0.3333,"winrate_diff_pp":-14.39,"wilson_low_pp":-41.58,"wilson_high_pp":31.51,"winrate_status":"insufficient","cut_entries":0,"cut_made":0,"conversion":null,"conversion_ratio":null,"conversion_status":"insufficient","rank":7},{"card_id":"weyland_consortium_built_to_last","entries":1,"share":0.125,"games":3,"wins":2.5,"winrate":0.8333,"winrate_diff_pp":35.61,"wilson_low_pp":-16.73,"wilson_high_pp":50.51,"winrate_status":"insufficient","cut_entries":0,"cut_made":0,"conversion":null,"conversion_ratio":null,"conversion_status":"insufficient","rank":8}]}